<?xml version="1.0" encoding="UTF-8"?>
<!DOCTYPE assessment_smoking_history SYSTEM "assessment_smoking_history.dtd">
<assessment_smoking_history>
<id>cc0e8400-e29b-41d4-a716-446655440007</id>
<assessment_id>660e8400-e29b-41d4-a716-446655440001</assessment_id>
<smoking_status>never</smoking_status>
<cigarettes_per_day>1</cigarettes_per_day>
<years_smoked>2026</years_smoked>
<years_since_quit>2026</years_since_quit>
<created_at>2026-04-09T10:00:00Z</created_at>
<updated_at>2026-04-09T10:00:00Z</updated_at>
</assessment_smoking_history>
